{
  "id": "minimal-reference-v1",
  "domain": "minimal",
  "archetype": "generic utility",
  "source_mode": "brief",
  "screens": [
    "home",
    "detail",
    "settings"
  ],
  "platforms": [
    "web",
    "swiftui",
    "compose"
  ],
  "constraints": {
    "themes": [
      "light",
      "dark"
    ],
    "locales": [
      "en",
      "ar"
    ],
    "accessibility": "AA",
    "motion": "reduced-motion-compatible"
  }
}
